{
  "$schema": "https://json-schema.org/draft/2020-12/schema",
  "$id": "https://evemisslab.com/spec/empsl-glyph-recipe-v0.4.schema.json",
  "title": "EMPSL Glyph Recipe v0.4",
  "type": "object",
  "additionalProperties": false,
  "required": [
    "id",
    "version",
    "frame",
    "seed_base",
    "seed_transform",
    "seed_variant",
    "phonology",
    "tone",
    "phase",
    "operator",
    "transform_role",
    "semantic",
    "acoustic",
    "validation_certificate",
    "recipe_sha256"
  ],
  "properties": {
    "id": {
      "type": "string",
      "pattern": "^[a-z][a-z0-9]*(\\.[a-z][a-z0-9]*)*:[a-z][a-z0-9_-]*:[0-9a-z_-]+$"
    },
    "version": {
      "const": "0.4"
    },
    "frame": {
      "enum": [
        "SEM-ENTITY",
        "SEM-PROCESS",
        "SEM-RELATION",
        "SEM-PROPERTY",
        "SEM-QUANTITY",
        "SEM-TIME",
        "SEM-SPACE",
        "SEM-MODALITY",
        "SEM-CAUSALITY",
        "SEM-EVIDENCE",
        "SEM-AGENT",
        "SEM-INFORMATION",
        "SEM-PERMISSION",
        "SEM-NEGATION",
        "SEM-AGGREGATION",
        "SEM-META"
      ]
    },
    "seed_base": {
      "enum": [
        "ENO-01",
        "ENO-02",
        "ENO-03",
        "ENO-04",
        "ENO-05",
        "ENO-06",
        "ENO-07",
        "ENO-08",
        "ENO-09",
        "ENO-10",
        "ENO-11",
        "ENO-12",
        "ENO-13",
        "ENO-14",
        "ENO-15",
        "ENO-16",
        "ENO-17",
        "ENO-18",
        "ENO-19",
        "ENO-20",
        "ENO-21",
        "STR-01",
        "STR-02",
        "STR-03",
        "STR-04",
        "STR-05",
        "STR-06",
        "STR-07",
        "STR-08",
        "STR-09",
        "STR-10",
        "STR-11"
      ]
    },
    "seed_transform": {
      "enum": [
        "ID",
        "R90",
        "R180",
        "MX",
        "OPEN-R",
        "CLOSED",
        "INSET",
        "CROSS"
      ]
    },
    "seed_variant": {
      "enum": [
        "ENO-01@ID",
        "ENO-01@R90",
        "ENO-01@R180",
        "ENO-01@MX",
        "ENO-01@OPEN-R",
        "ENO-01@CLOSED",
        "ENO-01@INSET",
        "ENO-01@CROSS",
        "ENO-02@ID",
        "ENO-02@R90",
        "ENO-02@R180",
        "ENO-02@MX",
        "ENO-02@OPEN-R",
        "ENO-02@CLOSED",
        "ENO-02@INSET",
        "ENO-02@CROSS",
        "ENO-03@ID",
        "ENO-03@R90",
        "ENO-03@R180",
        "ENO-03@MX",
        "ENO-03@OPEN-R",
        "ENO-03@CLOSED",
        "ENO-03@INSET",
        "ENO-03@CROSS",
        "ENO-04@ID",
        "ENO-04@R90",
        "ENO-04@R180",
        "ENO-04@MX",
        "ENO-04@OPEN-R",
        "ENO-04@CLOSED",
        "ENO-04@INSET",
        "ENO-04@CROSS",
        "ENO-05@ID",
        "ENO-05@R90",
        "ENO-05@R180",
        "ENO-05@MX",
        "ENO-05@OPEN-R",
        "ENO-05@CLOSED",
        "ENO-05@INSET",
        "ENO-05@CROSS",
        "ENO-06@ID",
        "ENO-06@R90",
        "ENO-06@R180",
        "ENO-06@MX",
        "ENO-06@OPEN-R",
        "ENO-06@CLOSED",
        "ENO-06@INSET",
        "ENO-06@CROSS",
        "ENO-07@ID",
        "ENO-07@R90",
        "ENO-07@R180",
        "ENO-07@MX",
        "ENO-07@OPEN-R",
        "ENO-07@CLOSED",
        "ENO-07@INSET",
        "ENO-07@CROSS",
        "ENO-08@ID",
        "ENO-08@R90",
        "ENO-08@R180",
        "ENO-08@MX",
        "ENO-08@OPEN-R",
        "ENO-08@CLOSED",
        "ENO-08@INSET",
        "ENO-08@CROSS",
        "ENO-09@ID",
        "ENO-09@R90",
        "ENO-09@R180",
        "ENO-09@MX",
        "ENO-09@OPEN-R",
        "ENO-09@CLOSED",
        "ENO-09@INSET",
        "ENO-09@CROSS",
        "ENO-10@ID",
        "ENO-10@R90",
        "ENO-10@R180",
        "ENO-10@MX",
        "ENO-10@OPEN-R",
        "ENO-10@CLOSED",
        "ENO-10@INSET",
        "ENO-10@CROSS",
        "ENO-11@ID",
        "ENO-11@R90",
        "ENO-11@R180",
        "ENO-11@MX",
        "ENO-11@OPEN-R",
        "ENO-11@CLOSED",
        "ENO-11@INSET",
        "ENO-11@CROSS",
        "ENO-12@ID",
        "ENO-12@R90",
        "ENO-12@R180",
        "ENO-12@MX",
        "ENO-12@OPEN-R",
        "ENO-12@CLOSED",
        "ENO-12@INSET",
        "ENO-12@CROSS",
        "ENO-13@ID",
        "ENO-13@R90",
        "ENO-13@R180",
        "ENO-13@MX",
        "ENO-13@OPEN-R",
        "ENO-13@CLOSED",
        "ENO-13@INSET",
        "ENO-13@CROSS",
        "ENO-14@ID",
        "ENO-14@R90",
        "ENO-14@R180",
        "ENO-14@MX",
        "ENO-14@OPEN-R",
        "ENO-14@CLOSED",
        "ENO-14@INSET",
        "ENO-14@CROSS",
        "ENO-15@ID",
        "ENO-15@R90",
        "ENO-15@R180",
        "ENO-15@MX",
        "ENO-15@OPEN-R",
        "ENO-15@CLOSED",
        "ENO-15@INSET",
        "ENO-15@CROSS",
        "ENO-16@ID",
        "ENO-16@R90",
        "ENO-16@R180",
        "ENO-16@MX",
        "ENO-16@OPEN-R",
        "ENO-16@CLOSED",
        "ENO-16@INSET",
        "ENO-16@CROSS",
        "ENO-17@ID",
        "ENO-17@R90",
        "ENO-17@R180",
        "ENO-17@MX",
        "ENO-17@OPEN-R",
        "ENO-17@CLOSED",
        "ENO-17@INSET",
        "ENO-17@CROSS",
        "ENO-18@ID",
        "ENO-18@R90",
        "ENO-18@R180",
        "ENO-18@MX",
        "ENO-18@OPEN-R",
        "ENO-18@CLOSED",
        "ENO-18@INSET",
        "ENO-18@CROSS",
        "ENO-19@ID",
        "ENO-19@R90",
        "ENO-19@R180",
        "ENO-19@MX",
        "ENO-19@OPEN-R",
        "ENO-19@CLOSED",
        "ENO-19@INSET",
        "ENO-19@CROSS",
        "ENO-20@ID",
        "ENO-20@R90",
        "ENO-20@R180",
        "ENO-20@MX",
        "ENO-20@OPEN-R",
        "ENO-20@CLOSED",
        "ENO-20@INSET",
        "ENO-20@CROSS",
        "ENO-21@ID",
        "ENO-21@R90",
        "ENO-21@R180",
        "ENO-21@MX",
        "ENO-21@OPEN-R",
        "ENO-21@CLOSED",
        "ENO-21@INSET",
        "ENO-21@CROSS",
        "STR-01@ID",
        "STR-01@R90",
        "STR-01@R180",
        "STR-01@MX",
        "STR-01@OPEN-R",
        "STR-01@CLOSED",
        "STR-01@INSET",
        "STR-01@CROSS",
        "STR-02@ID",
        "STR-02@R90",
        "STR-02@R180",
        "STR-02@MX",
        "STR-02@OPEN-R",
        "STR-02@CLOSED",
        "STR-02@INSET",
        "STR-02@CROSS",
        "STR-03@ID",
        "STR-03@R90",
        "STR-03@R180",
        "STR-03@MX",
        "STR-03@OPEN-R",
        "STR-03@CLOSED",
        "STR-03@INSET",
        "STR-03@CROSS",
        "STR-04@ID",
        "STR-04@R90",
        "STR-04@R180",
        "STR-04@MX",
        "STR-04@OPEN-R",
        "STR-04@CLOSED",
        "STR-04@INSET",
        "STR-04@CROSS",
        "STR-05@ID",
        "STR-05@R90",
        "STR-05@R180",
        "STR-05@MX",
        "STR-05@OPEN-R",
        "STR-05@CLOSED",
        "STR-05@INSET",
        "STR-05@CROSS",
        "STR-06@ID",
        "STR-06@R90",
        "STR-06@R180",
        "STR-06@MX",
        "STR-06@OPEN-R",
        "STR-06@CLOSED",
        "STR-06@INSET",
        "STR-06@CROSS",
        "STR-07@ID",
        "STR-07@R90",
        "STR-07@R180",
        "STR-07@MX",
        "STR-07@OPEN-R",
        "STR-07@CLOSED",
        "STR-07@INSET",
        "STR-07@CROSS",
        "STR-08@ID",
        "STR-08@R90",
        "STR-08@R180",
        "STR-08@MX",
        "STR-08@OPEN-R",
        "STR-08@CLOSED",
        "STR-08@INSET",
        "STR-08@CROSS",
        "STR-09@ID",
        "STR-09@R90",
        "STR-09@R180",
        "STR-09@MX",
        "STR-09@OPEN-R",
        "STR-09@CLOSED",
        "STR-09@INSET",
        "STR-09@CROSS",
        "STR-10@ID",
        "STR-10@R90",
        "STR-10@R180",
        "STR-10@MX",
        "STR-10@OPEN-R",
        "STR-10@CLOSED",
        "STR-10@INSET",
        "STR-10@CROSS",
        "STR-11@ID",
        "STR-11@R90",
        "STR-11@R180",
        "STR-11@MX",
        "STR-11@OPEN-R",
        "STR-11@CLOSED",
        "STR-11@INSET",
        "STR-11@CROSS"
      ]
    },
    "phonology": {
      "type": "array",
      "maxItems": 4,
      "uniqueItems": true,
      "items": {
        "enum": [
          "ONSET-B",
          "ONSET-P",
          "ONSET-M",
          "ONSET-F",
          "ONSET-D",
          "ONSET-T",
          "ONSET-N",
          "ONSET-L",
          "ONSET-G",
          "ONSET-K",
          "ONSET-H",
          "ONSET-J",
          "ONSET-Q",
          "ONSET-X",
          "ONSET-ZH",
          "ONSET-CH",
          "ONSET-SH",
          "ONSET-R",
          "ONSET-Z",
          "ONSET-C",
          "ONSET-S",
          "HU-KAIKOU",
          "HU-QICHI",
          "HU-HEKOU",
          "HU-CUOKOU",
          "RIME-A",
          "RIME-O",
          "RIME-E",
          "RIME-AI",
          "RIME-EI",
          "RIME-AO",
          "RIME-OU",
          "RIME-AN",
          "RIME-EN",
          "RIME-ANG",
          "RIME-ENG",
          "RIME-ER",
          "ST-ZERO",
          "ST-NASAL",
          "ST-RHOTIC",
          "ST-LIGHT",
          "ST-LONG",
          "ST-BOUNDARY"
        ]
      }
    },
    "tone": {
      "enum": [
        "T1",
        "T2",
        "T3",
        "T4",
        "T0"
      ]
    },
    "phase": {
      "enum": [
        "PH16-00",
        "PH16-01",
        "PH16-02",
        "PH16-03",
        "PH16-04",
        "PH16-05",
        "PH16-06",
        "PH16-07",
        "PH16-08",
        "PH16-09",
        "PH16-10",
        "PH16-11",
        "PH16-12",
        "PH16-13",
        "PH16-14",
        "PH16-15"
      ]
    },
    "operator": {
      "enum": [
        "OP-NULL",
        "OP-UNARY",
        "OP-BINARY",
        "OP-TERNARY",
        "OP-VARIADIC",
        "OP-BIND",
        "OP-QUOTE",
        "OP-META",
        "OP-TEMP",
        "OP-MODAL",
        "OP-NEG",
        "OP-CAUSE",
        "OP-AGG",
        "OP-MAP",
        "OP-REDUCE",
        "OP-GUARD"
      ]
    },
    "transform_role": {
      "enum": [
        "identity",
        "allographic",
        "semantic_modifier",
        "structural"
      ]
    },
    "semantic": {
      "type": "object",
      "additionalProperties": false,
      "required": [
        "kind",
        "concept_id",
        "signature"
      ],
      "properties": {
        "kind": {
          "enum": [
            "item",
            "predicate",
            "operator",
            "binder",
            "delimiter",
            "meta"
          ]
        },
        "concept_id": {
          "type": "string",
          "pattern": "^[a-z][a-z0-9]*(\\.[a-z][a-z0-9]*)*:[a-z][a-z0-9_-]*:[0-9a-z_-]+$"
        },
        "signature": {
          "type": "object",
          "additionalProperties": false,
          "required": [
            "inputs",
            "output",
            "arity"
          ],
          "properties": {
            "inputs": {
              "type": "array",
              "items": {
                "enum": [
                  "Any",
                  "Entity",
                  "Event",
                  "Relation",
                  "Property",
                  "Quantity",
                  "Time",
                  "Space",
                  "Modality",
                  "Evidence",
                  "Agent",
                  "Information",
                  "Permission",
                  "Boolean",
                  "Collection",
                  "Meta"
                ]
              },
              "maxItems": 8
            },
            "output": {
              "enum": [
                "Any",
                "Entity",
                "Event",
                "Relation",
                "Property",
                "Quantity",
                "Time",
                "Space",
                "Modality",
                "Evidence",
                "Agent",
                "Information",
                "Permission",
                "Boolean",
                "Collection",
                "Meta"
              ]
            },
            "arity": {
              "oneOf": [
                {
                  "type": "object",
                  "additionalProperties": false,
                  "required": [
                    "mode",
                    "value"
                  ],
                  "properties": {
                    "mode": {
                      "const": "fixed"
                    },
                    "value": {
                      "type": "integer",
                      "minimum": 0,
                      "maximum": 8
                    }
                  }
                },
                {
                  "type": "object",
                  "additionalProperties": false,
                  "required": [
                    "mode",
                    "min",
                    "max"
                  ],
                  "properties": {
                    "mode": {
                      "const": "variadic"
                    },
                    "min": {
                      "type": "integer",
                      "minimum": 0,
                      "maximum": 8
                    },
                    "max": {
                      "type": [
                        "integer",
                        "null"
                      ],
                      "minimum": 0,
                      "maximum": 32
                    }
                  }
                }
              ]
            }
          }
        }
      }
    },
    "acoustic": {
      "type": "object",
      "additionalProperties": false,
      "required": [
        "source",
        "class",
        "phase_signature",
        "profile_id",
        "confidence"
      ],
      "properties": {
        "source": {
          "enum": [
            "NONE",
            "FARHP-Y",
            "FARHP-G"
          ]
        },
        "class": {
          "enum": [
            "voiced_harmonic",
            "mixed",
            "noise_dominant",
            "silent"
          ]
        },
        "phase_signature": {
          "enum": [
            "PH16-00",
            "PH16-01",
            "PH16-02",
            "PH16-03",
            "PH16-04",
            "PH16-05",
            "PH16-06",
            "PH16-07",
            "PH16-08",
            "PH16-09",
            "PH16-10",
            "PH16-11",
            "PH16-12",
            "PH16-13",
            "PH16-14",
            "PH16-15"
          ]
        },
        "profile_id": {
          "type": [
            "string",
            "null"
          ],
          "pattern": "^[a-z][a-z0-9]*(\\.[a-z][a-z0-9]*)*:[a-z][a-z0-9_-]*:[0-9a-z_-]+$"
        },
        "confidence": {
          "type": "number",
          "minimum": 0,
          "maximum": 1
        }
      }
    },
    "reading": {
      "type": "string"
    },
    "gloss": {
      "type": "string"
    },
    "validation_certificate": {
      "type": "object",
      "additionalProperties": false,
      "required": [
        "valid",
        "status",
        "error_count",
        "warning_count",
        "issues",
        "ruleset_sha256"
      ],
      "properties": {
        "valid": {
          "type": "boolean"
        },
        "status": {
          "enum": [
            "PASS",
            "FAIL"
          ]
        },
        "error_count": {
          "type": "integer",
          "minimum": 0
        },
        "warning_count": {
          "type": "integer",
          "minimum": 0
        },
        "issues": {
          "type": "array",
          "items": {
            "type": "object",
            "additionalProperties": false,
            "required": [
              "rule_id",
              "severity",
              "domain",
              "message",
              "field",
              "suggestion"
            ],
            "properties": {
              "rule_id": {
                "type": "string",
                "pattern": "^[GPTSA]-[0-9]{3}$"
              },
              "severity": {
                "enum": [
                  "error",
                  "warning"
                ]
              },
              "domain": {
                "enum": [
                  "glyph",
                  "phonology",
                  "transform",
                  "semantics",
                  "acoustics"
                ]
              },
              "message": {
                "type": "string"
              },
              "field": {
                "type": "string"
              },
              "suggestion": {
                "type": "string"
              }
            }
          }
        },
        "ruleset_sha256": {
          "type": "string",
          "pattern": "^[0-9a-f]{64}$"
        }
      }
    },
    "recipe_sha256": {
      "type": "string",
      "pattern": "^[0-9a-f]{64}$"
    },
    "_mutation": {
      "type": "string"
    }
  }
}