{
  "id": "eml.empsl:glyph:light-closed",
  "version": "0.4",
  "frame": "SEM-ENTITY",
  "seed_base": "ENO-07",
  "seed_transform": "CLOSED",
  "seed_variant": "ENO-07@CLOSED",
  "phonology": [
    "ONSET-G",
    "HU-HEKOU",
    "RIME-ANG"
  ],
  "tone": "T1",
  "phase": "PH16-05",
  "operator": "OP-NULL",
  "transform_role": "structural",
  "semantic": {
    "kind": "item",
    "concept_id": "eml.concept:item:physical-light",
    "signature": {
      "inputs": [],
      "output": "Entity",
      "arity": {
        "mode": "fixed",
        "value": 0
      }
    }
  },
  "acoustic": {
    "source": "FARHP-Y",
    "class": "voiced_harmonic",
    "phase_signature": "PH16-05",
    "profile_id": "eml.farhp:profile:light-v01",
    "confidence": 0.92
  },
  "reading": "ㄍㄨㄤ",
  "gloss": "光；具閉合語義外觀的示範詞素",
  "validation_certificate": {
    "valid": true,
    "status": "PASS",
    "error_count": 0,
    "warning_count": 0,
    "issues": [],
    "ruleset_sha256": "84fecd66f230f4c52fd125e45a4164c96c7afc8fad5c6f40fa47c9f67f3cb689"
  },
  "recipe_sha256": "ef5406e3ebb7c633f5768627a2f734f6ebdbdb720cfd0dfe6183489d0947faf4"
}